{"$schema":"https://json-schema.org/draft/2020-12/schema","type":"object","additionalProperties":false,"required":["schema_id","schema_version","historical_anchor","profiles"],"properties":{"schema_id":{"const":"external_validation.profile_status_chain.v2"},"schema_version":{"const":"2"},"historical_anchor":{"type":"object"},"profiles":{"type":"object","required":["detection","remediation","overall"]}}}
