{
  "schema_id": "external_validation.profile_status_chain.v2",
  "schema_version": "2",
  "historical_anchor": {
    "chain_path": "external_validation/status/session1-status-chain.v1.json",
    "chain_hash": "sha256:95d832a8d71db8bcfba4d7275724bb40eb0cc1859593fdaea3e4269daceb9427",
    "effective_status_id": "session1-security-evidence-repair-qualified",
    "predecessor_branch": "codex/external-validation-session1-repair",
    "predecessor_commit": "72e0884a69cbf57c17bc7b620c2c4a1314d3fe01"
  },
  "profiles": {
    "detection": [
      {"status_id":"session1-control-plane-detection-retained","predecessor_status_id":"session1-security-evidence-repair-qualified","profile":"detection","status":"QUALIFIED","implementation_commit":"72e0884a69cbf57c17bc7b620c2c4a1314d3fe01","timestamp":"2026-07-27T00:00:00Z"},
      {"status_id":"session1-control-plane-detection-final","predecessor_status_id":"session1-control-plane-detection-retained","profile":"detection","status":"QUALIFIED","implementation_commit":"48fa698d1395b4d2d503394c64d82761f4ee885d","implementation_tree":"1cc23ca65b174bbc0ab424ef047fa7c1c12c045f","proof_bundle_hash":"sha256:2407280915aedf84b05e15374bc35c4d43f6a21ac076a62f0d94baa874e1b221","predecessor_status_ids":{"detection":"session1-control-plane-detection-retained","remediation":"session1-control-plane-remediation-reopened","overall":"session1-control-plane-overall-partially-qualified"},"expected_profiles":{"detection":"QUALIFIED","remediation":"QUALIFIED","overall":"QUALIFIED"},"timestamp":"2026-07-27T15:00:00Z"}
    ],
    "remediation": [
      {"status_id":"session1-control-plane-remediation-reopened","predecessor_status_id":"session1-security-evidence-repair-qualified","profile":"remediation","status":"REOPENED","implementation_commit":"72e0884a69cbf57c17bc7b620c2c4a1314d3fe01","timestamp":"2026-07-27T00:00:00Z"},
      {"status_id":"session1-control-plane-remediation-final","predecessor_status_id":"session1-control-plane-remediation-reopened","profile":"remediation","status":"QUALIFIED","implementation_commit":"48fa698d1395b4d2d503394c64d82761f4ee885d","implementation_tree":"1cc23ca65b174bbc0ab424ef047fa7c1c12c045f","proof_bundle_hash":"sha256:2407280915aedf84b05e15374bc35c4d43f6a21ac076a62f0d94baa874e1b221","predecessor_status_ids":{"detection":"session1-control-plane-detection-retained","remediation":"session1-control-plane-remediation-reopened","overall":"session1-control-plane-overall-partially-qualified"},"expected_profiles":{"detection":"QUALIFIED","remediation":"QUALIFIED","overall":"QUALIFIED"},"timestamp":"2026-07-27T15:00:00Z"}
    ],
    "overall": [
      {"status_id":"session1-control-plane-overall-partially-qualified","predecessor_status_id":"session1-security-evidence-repair-qualified","profile":"overall","status":"PARTIALLY_QUALIFIED","implementation_commit":"72e0884a69cbf57c17bc7b620c2c4a1314d3fe01","timestamp":"2026-07-27T00:00:00Z"},
      {"status_id":"session1-control-plane-overall-final","predecessor_status_id":"session1-control-plane-overall-partially-qualified","profile":"overall","status":"QUALIFIED","implementation_commit":"48fa698d1395b4d2d503394c64d82761f4ee885d","implementation_tree":"1cc23ca65b174bbc0ab424ef047fa7c1c12c045f","proof_bundle_hash":"sha256:2407280915aedf84b05e15374bc35c4d43f6a21ac076a62f0d94baa874e1b221","predecessor_status_ids":{"detection":"session1-control-plane-detection-retained","remediation":"session1-control-plane-remediation-reopened","overall":"session1-control-plane-overall-partially-qualified"},"expected_profiles":{"detection":"QUALIFIED","remediation":"QUALIFIED","overall":"QUALIFIED"},"timestamp":"2026-07-27T15:00:00Z"}
    ]
  }
}
